{
  "person": [
    {
      "person_id": 1,
      "gender_concept_id": 8532,
      "year_of_birth": 1958,
      "month_of_birth": 2,
      "day_of_birth": 21,
      "race_concept_id": null,
      "ethnicity_concept_id": null,
      "location_id": null,
      "provider_id": null,
      "care_site_id": null,
      "person_source_value": null,
      "gender_source_value": null,
      "gender_source_concept_id": null,
      "race_source_value": null,
      "race_source_concept_id": null,
      "ethnicity_source_value": null,
      "ethnicity_source_concept_id": null
    }
  ],
  "observation_period": [
    {
      "observation_period_id": 1,
      "person_id": 1,
      "observation_period_start_date": "2010-02-28",
      "observation_period_end_date": "2015-02-28",
      "period_type_concept_id": 44191562
    }
  ],
  "drug_exposure": [],
  "condition_occurrence": []
}
